{
  "approved_head_sha": "8e638d179f523ff873e112acdad61715619855ce",
  "approved_tree_sha": "cb22432152b6545e89100def08c039de86463dea",
  "range_start_sha": "e327b92068f9df7e74d6d29dc493f0534941b93e",
  "range_end_sha": "8e638d179f523ff873e112acdad61715619855ce",
  "simulated": false,
  "engine": "codex_cli",
  "model": "api",
  "created_at": "2026-03-01T22:47:59Z",
  "verdict_artifact_path": "review_packets/20260301_224756/CODEX_VERDICT.json",
  "signature": "37f84d9ce2fcf6c20155265ef62fc6e7f2b11c844bb09cbff3121d9e7bc57fb3"
}
